{
  "$schema": "https://json-schema.org/draft/2020-12/schema",
  "$id": "place.schema.json",
  "title": "Картка місця (data/places/<id>.json)",
  "description": "Схему виведено з реального коду index.html: поля name, coords(→lat/lng), desc, gmapsUrl, media[], near. Службові поля інтерфейсу (selected, dataId) у каталог не потрапляють.",
  "type": "object",
  "additionalProperties": false,
  "required": ["id", "order", "name", "lat", "lng", "updated"],
  "properties": {
    "id": { "type": "string", "pattern": "^[a-z0-9]+(?:-[a-z0-9]+)*$", "maxLength": 64, "description": "Стабільний slug (латиниця, цифри, дефіси). Збігається з назвою файлу. Не змінюється при перейменуванні." },
    "order": { "type": "integer", "minimum": 1, "description": "Позиція в списку (маршрути будуються за цим порядком). Унікальна в межах каталогу." },
    "name": { "type": "string", "minLength": 1, "maxLength": 200, "description": "Назва; може містити лапки, кирилицю, діакритику. Простий текст (HTML екранується сайтом)." },
    "lat": { "type": "number", "minimum": -90, "maximum": 90, "description": "Широта, градуси (до 7 знаків)." },
    "lng": { "type": "number", "minimum": -180, "maximum": 180, "description": "Довгота, градуси (до 7 знаків)." },
    "desc": { "type": "string", "maxLength": 2000, "description": "Нотатки (простий текст). Може бути порожнім." },
    "gmapsUrl": { "type": "string", "pattern": "^$|^https?://", "description": "Власне посилання Google Maps; порожнє — сайт відкриє карту за координатами." },
    "near": { "type": "string", "maxLength": 120, "description": "Найближче селище/місто (необов'язково; можна заповнити скриптом fill-near)." },
    "category": { "type": ["string", "null"], "maxLength": 60, "description": "Категорія (поки не використовується сайтом; null — не задано)." },
    "media": {
      "type": "array",
      "description": "Фото й відео картки в порядку показу. Шляхи — відносно теки data/.",
      "items": {
        "type": "object",
        "additionalProperties": false,
        "required": ["type", "file", "bytes"],
        "properties": {
          "type": { "type": "string", "enum": ["image", "video"] },
          "file": { "type": "string", "pattern": "^photos/[a-z0-9-]+/\\d{2}\\.(webp|mp4)$", "description": "image → NN.webp (до 1600 px); video → NN.mp4 (без перекодування)" },
          "thumb": { "type": "string", "pattern": "^photos/[a-z0-9-]+/\\d{2}_thumb\\.webp$", "description": "Мініатюра (лише для image)" },
          "mime": { "type": "string", "description": "MIME-тип (для video)" },
          "width": { "type": "integer", "minimum": 1 },
          "height": { "type": "integer", "minimum": 1 },
          "bytes": { "type": "integer", "minimum": 1, "maximum": 26214400 }
        }
      }
    },
    "updated": { "type": "string", "pattern": "^\\d{4}-\\d{2}-\\d{2}$", "description": "Дата останньої зміни (YYYY-MM-DD)." }
  }
}
